title,pub_date,category,body,link
"„A glikémiás index elve évekkel ezelőtt megdőlt” – kipróbáltuk a vércukrot folyamatosan mérő kütyüt, és kiderült, az sem mindegy, mit mivel eszünk",2025-12-23 18:30:00+00:00,hvg360,"A vércukorszint mérését sokáig egyetlen kép határozta meg: egy fájdalmas ujjbegyszúrás, egy apró vércsepp, majd egy szám a kijelzőn. A technológiai fejlődésnek köszönhetően azonban a vércukorszint követése kilépett a kórházak és rendelők világából, és olyan eszközök jelentek meg, amelyek egész nap szinte észrevétlenül figyelik szervezetünk működését. A glükózmonitorok már nemcsak pillanatnyi adatokat adnak a vércukorszintünkről, hanemtörténeteket mesélnek arról, hogyan reagál a testünk minden elfogyasztott falatra, a mozgásra vagy a stresszhelyzetekre.Az eszközt elsősorban cukorbetegek használják, de az elmúlt néhány évben preventív céllal is elkezdték alkalmazni például inzulinrezisztenciásoknál, emellett azok számára is fontos kellék lett, akik támogatni szeretnék a fogyásukat, vagy még többet tennének egészségükért.Testünk küzd a fogyás ellen, de néhány szabály betartásával ki tudjuk cselezni„Egyen kevesebbet, mozogjon többet” – aki túlsúllyal küzd, gyakran megkapja ezt a jó tanácsot, a szervezet azonban nagyon nehezen engedi el a felszedett kilókat. Miben téved sok orvos is az elhízással kapcsolatban? Hogyan működik a fogyás matematikája? Mennyi ideig tart a szervezetnek, amíg „sajátjának érzi” az elért álomsúlyt? Mikor alkalmaznak gyógyszeres terápiát?Mikor érdemes foglalkozni a vércukorral?A diabéteszesek állapota jól karban tartható (hogy ez miért létfontosságú, arról lásd keretes írásunkat), ehhez azonban elengedhetetlen a rendszeres, napi szintű vércukormérés. Az így kinyerhető adatok pontos képet adnak a szervezet aktuális anyagcsere-állapotáról, és segítenek időben felismerni a kezdődő eltéréseket. A korai megelőzés szó szerint életeket menthet,a gyakori mérés pedig lehetőséget ad arra, hogy a páciens lássa, hogyan reagál a szervezete a különböző ételekre, napszakokra, mozgásformákra vagy akár a stresszhelyzetekre.„Sok esetben a hagyományos labormarkerek normál értékeket mutatnak, mi pedig a glükózmonitorral már látjuk a problémát. Ilyenkor van lehetőség arra, hogy időben közbelépjünk, még mielőtt a betegség kialakul, vagy épp társbetegségek is kapcsolódnak hozzá” – mondja Rákóczi Gabriella dietetikus, anyagcsere-kutató.Ezek az információk segítenek abban, hogy az étrend és az életmód valóban személyre szabott és hatékony legyen. A cukorbetegek számára a vércukor-ellenőrzés az optimális gyógyszeres és inzulinkezelés beállításának alapja, hiszen enélkül nem látható, működik-e a terápia. De azoknak is fontos lehet, akiket még nem diagnosztizáltak.Több mint minden kilencedik magyar érintettA Nemzetközi Diabetes Társaság adatai szerint a világon több mint félmilliárd felnőtt cukorbeteg él, vagyis a Föld minden tizedik nagykorú lakója érintett. A leggyakoribb anyagcsere-betegség egyre nagyobb százalékban és egyre szélesebb korosztályban érinti a magyar lakosságot is. A KSH adatai szerint több mint 1,1 millió regisztrált cukorbeteg él ma Magyarországon, de a kezelt betegek számánál jóval nagyobb lehet azoké, akiknél nem fedezték fel a betegséget.Sokanmég mindig nincsenek tisztábana betegség pusztító következményeivel. A tartósan magas vércukorszint károsíthatja az ereket és az idegeket, ami növeli a szív- és érrendszeri betegségek, a vesekárosodás, a látásromlás, a gutaütés és a neuropátia kockázatát. Évente nagyjából félmillióan halnak meg diabétesz talaján kialakuló vesebetegségben a világon, a nem vagy rosszul kezelt cukorbetegség pedig extrém módon, 15–16-szorosára növelia láb elvesztésének rizikóját. Magyarország ebben élen jár, évente körülbelül 8000 végtagcsonkolás történik, ez a nyugat-európai átlag többszöröse.„Az emberek túlnyomó része nem megy orvoshoz, csak akkor, ha valamilyen panasza van, de nem érdemes addig várni, amíg ég a ház. A korai vércukoreltérésekhez sok esetben nem társul tünet, így előfordulhat, hogy a rejtett tünetek csak hosszú évek vagy akár évtizedek múltán fordulnak át cukorbetegségbe” – mondja a szakértő. A fáradékonyság, az alvásproblémák, a hízás vagy bármilyen erőteljesebb változás azt jelezheti, hogy érdemes foglalkoznunk a vércukorszintünkkel, főként akkor, ha volt már cukorbeteg a családban, vagy a testtömeg-indexünk a normál érték feletti.",https://hvg.hu/360/20251223_vercukorszint-meres-glukozmonitor-cukorbetegseg-inzulin-diabetesz-egeszseges-eletmod
"A brit rendőrség meggyanúsította Russel Brandet, miután újabb két nő vádolta meg szexuális zaklatással",2025-12-23 18:03:42+00:00,Élet+Stílus,"Két újabb nő vádolta meg Russel Brandet szexuális erőszakkal, a brit rendőrség pedig kedden meggyanúsította a színész-humoristát, aki a kétezres években rendszeresen szerepelt a médiában – írja aSky News.Az ötvenéves Brandnek jövő januárban kell megjelennie egy westminsteri bíróságon az őt ért vádak miatt. Idén tavasszal már a brit rendőrség vádat emelt a színész ellen nemi erőszak és többrendbeli testi sértés miatt négy különböző, 1999 és 2005 között történt ügyben. Jövőre folytatódni fog ezeknek az ügyeknek a feltárása is, júniusban kezdődik majd a tárgyalás az eredeti öt vádponttal kapcsolatban.Az újabb vádakról a nyomozást vezető Tariq Farooqi londoni főnyomozó elmondta, hogy tanúkat keres a rendőrség. Hozzátette: a két nő, akik megtették az újabb bejelentéseket, támogatást kapnak speciálisan képzett szakemberektől.Russel Brand korábban dolgozott a BBC-nél és számos filmben szerepelt, ilyen például a 2010-es Felhangolva. Ebben az évben vette feleségülKaty Perryt, akitől 14 hónap házasság utánelvált, az énekesnő aztán hosszú évekig Orlando Bloom jegyese volt, majd az újabbszakításután néhány hónapjarandizni kezdettJustin Trudeau volt kanadai miniszterelnökkel.A többek között szexuális erőszakkal megvádolt Russel Brand a kétezres években extravagáns stílusáról és megjelenéséről volt ismert, ám idővel kikopott a rivaldafényből, majd 2023-bankerült ismét a címlapokra, amikor a Times, a Sunday Times és a Channel 4 oknyomozó riportja szerint is 2006 és 2013 között négy nőt bántalmazott, nemi erőszakkal, testi sértéssel és érzelmi visszaéléssel vádolták meg. A brit rendőrséghez ezután számos további bejelentés érkezett Brand ellen Londonból és az ország más részeiből is. Russell Brand tagadja a vádakat, és kitart amellett, hogy a kapcsolatai mindig beleegyezésen alapultak.Rengeteg bejelentés érkezett a brit rendőrséghez Russell Branddel kapcsolatbanMinden vádat kivizsgálnak, zajlik a nyomozás.Nyitókép: AFP / NurPhoto / WIktor Szymanowicz",https://hvg.hu/elet/20251223_A-brit-rendorseg-meggyanusitotta-Russel-Brandet-miutan-ujabb-ket-no-vadolta-meg-szexualis-zaklatassal-szinesz-london-birosag-targyalas
"Ha másért nem, ezért mindenképpen szedjen C-vitamint",2025-12-23 18:03:00+00:00,Tech,"A nagy dózisú C-vitamin bizonyos mértékben megvédheti a tüdőt a levegőben lévő finom részecskék káros hatásavai szemben – állapították meg a Sydney-i Műszaki Egyetem kutatói. A PM2,5– amely olyan légszennyező anyagot jelent, amelynek átmérője 2,5 mikrométer, vagy annál kisebb – komoly egészségügyi problémákat okozhat, például asztmát vagy tüdőrákot.AScience Alertbeszámolója szerint a kutatók hím egereken és laboratóriumban tenyésztett emberi szöveteken végeztek kísérletsorozatot, hogy teszteljék, milyen hatással van a C-vitamin a finom részecskéknek kitett szövetekre. Azt találták, hogy a vitamin védelmet nyújt a sejtekben a légszennyezés által jellemzően okozott alapvető károsodások egy része ellen.A C-vitamin különösen csökkentette a sejtek mitokondriális „erőműveinek” elvesztését, mérsékelte a káros gyulladásokat, valamint megakadályozta, hogy a sejteket az oxidatív stressz – az instabil, reaktív molekulák által okozott támadások – károsítsa. Ez utóbbi számos működési zavart eredményezhet.A C-vitamint azért kezdték el tesztelni a szakemberek, mert egy régóta ismert antioxidánsról van szó. Az eredményeket azEnvironment Internationalcímű tudományos lapban publikálták.Több millió ember hal meg minden évben a hőhullámok és a légszennyezettség miattÉvente több millió halálos áldozatot követel a fosszilis tüzelőanyagoktól való függőség, a globális felmelegedés és az éghajlatváltozáshoz való lassú alkalmazkodás – figyelmeztet egy új nemzetközi tanulmány.Bár a tanulmány eredményei biztatóak, további kutatásokra van szükség annak megállapítására, hogy a vitamin elérhető dózisai a való életben ugyanúgy védik-e az embert, mint a laboratóriumban növesztett szöveteket és az egereket. A szennyezés szintjét és a C-vitamin dózisát gondosan kalibrálták a laboratóriumban, ami nem feltétlenül tükrözik a legtöbb ember valós kitettségét.A PM2,5részecskék legtöbb esetben az autóforgalomból, a bozóttüzekből vagy a porviharokból származnak. Azt csak az elmúlt években kezdték el megérteni a szakemberek, hogy ezek valójában milyen káros hatással vannak az ember szervezetére.A mostani tanulmány arra is rávilágít, hogy az ilyen típusú légszennyezés a sejtek szintjén már alacsony expozíció mellett is drámai mértékű negatív hatást kozhat.Ha máskor is tudni szeretne hasonló dolgokról, lájkoljaa HVG Tech rovatának tudományos felfedezésekről is hírt adó Facebook-oldalát.",https://hvg.hu/tudomany/20251223_legszennyezes-c-vitamin-sejt-valtozas-negativ-hatas-egeszseg
"Az Akadémiai Dolgozók Fóruma közölte, nem fél a HUN-REN fenyegetőzésétől, viszont várja a válaszokat a kérdéseire",2025-12-23 18:01:56+00:00,Itthon,"A HUN-RENMagyar Kutatási Hálózat pénteki közleményében azt állította, hogy valótlan információk láttak napvilágot a működésével kapcsolatban. Az Akadémiai Dolgozók Fórumának (ADF) állításaival kapcsolatban azt közölte, hogy valótlan, hogy nem rendelkeznek érvényes és hatályos szervezeti és működési szabályzattal. Szerintük a jogelőd intézmények eddigi szervezeti és működési szabályzatai továbbra is érvényesek, azoknak “felülvizsgálata folyamatban van. Szerintük az sem igaz, hogy ők lennének a felelősek azért, hogy a szervezet nyilvántartásba vételéről szóló bírósági döntés „apróbb elírást, technikai pontatlanságot tartalmazott”, és hogy nem egyértelmű a szervezetben a munkáltatói jogok gyakorlása.A lapunk által megírt 9,4 milliós felsővezetői béreket tételesen nem cáfolták, azzal kapcsolatban megjegyezték, hogy hogy szerintük a „felsővezetői bérezése megegyezik az állami szférában a hasonló felelősségi körű felsővezetői pozíciókban alkalmazott javadalmazások bérszínvonalával.”Szerintük hamis annak a képnek a sugallása, hogy a szervezet “nem a céloknak és küldetésnek megfelelően, a jogszabályok szerint meghatározott rendben működne” . A HUN-REN közleményében jogi lépéseket helyezett kilátásba.Fejek hullottak a HUN-REN-ben, miután megírtuk a vezetők több mint 9 milliós fizetésétA magas fizetések ellenére úgy tűnik, nem végzik jól a dolgukat a HUN-REN felső vezetői, mert képtelenek voltak helyesen bejegyeztetni a bíróságon a szervezetre vonatkozó információkat. A kutatóközpontok SZMSZ nélkül működnek, és az sem tisztázott, ki gyakorolja a munkáltatói jogkört.AzAkadémia Dolgozók Fóruma (ADF) közleményben reagált a szervezet állításaira, azt írják, hogy hiába fenyegetőznek a HUN-REN vezetői jogi lépésekkel, az ADF áll az eljárások elébe, és támogatja, hogy kiderüljön az igazság a HUN-REN működésével kapcsolatban. Azt is hozzáteszik, hogy ha a HUN-REN elküldi a lent felsorolt kérdésekre a hiteles információkat, akkor az ADF igyekszik azokat a legszélesebb közönséghez eljuttatni.Az ADF a következőket szeretné tudni:– Gulyás Balázs elnök és Jakab Roland DPK-tag vezérigazgató fizetésének pontos összegét és alakulását az egyéb juttatásokkal és költségtérítésekkel együtt.– Az erről döntő irányítótestületi határozat pontos szövegét.– Általában az Irányító Testület határozatait, amelyek nem elérhetők.– Az Irányító Testület jegyzőkönyveit, melyek szintén nem elérhetők, különös tekintettel arra az ülésre, amikor a négy kutatóközpont elcsatolásáról döntöttek, és ami után több tag lemondott.– Az új szmsz-ek szövegét, tekintettel arra, hogy teljesen új magánszervezet jött létre, ezért kétséges, hogy a központi költségvetési szervekre vonatkozó szabályzatok alapján tovább lehetne működtetni a kutatóhálózatot.– Az ELTE-vel és a minisztériummal kötött szerződéseket az elcsatolásról, a mellékletekkel együtt.– A bírósághoz benyújtott okiratokat a hibák listájával.– A hiánypótlást a hibák javításával, a benyújtás időpontjával együtt.– A bíróság válaszát.Az ADF további kérdéseket is feltett:– Mit lehet tudni arról a kockázatitőke-alapról, amelyet a HUN-REN létrehozni kíván? (Különös tekintettel arra, hogy ez a működési forma a NER-ben is nagy népszerűségnek örvend.)– Pontosan mennyit költöttek a nemzetközi átvilágításra?– Hol vannak az átvilágítás során készült dokumentumok?– Hol javasolta az átvilágítást végző bizottság, hogy szüntessék meg a kutatóhálózat egységét, és központokat válasszanak le?– Milyen jogcímen használja a HUN-REN az MTA vagyonát?– Hol érhető el a Hankó Balázzsal kötött 25 éves keretmegállapodás és a 6 éves finanszírozási szerződés szövege a mellékletekkel?– A BME-hez hasonlóan felmerült-e, hogy a magánosított HUN-REN is eleshet az uniós forrásoktól, és ha igen, ezeket miből pótolnák?– Hol tart jelenleg a kutatóközpontok jogállásában bekövetkezett változtatások átvezetése az uniós szervek előtt?A köztársasági elnöknél és a jegybankelnöknél is magasabb fizetést visznek haza a HUN-REN felső vezetőiKözépvezetőnek, de még hivatalnoknak is jobb lenni, mint kutatónak a HUN-REN-ben. A kutatói átlagbér csak bruttó 800 ezer forint, a két felső vezető bére viszont másfél év alatt több mint duplájára nőtt, és egyenként eléri a bruttó 9,4 milliót. A HVG birtokába jutott belső feljegyzés szerint 2025-ben hiába lett több pénze a természettudományi kutatóközpontnak, égetően fontos fejlesztésekre nem jutott.Azt írják, hogy ha ezekkel a kérdésekkel kapcsolatban az ADF bármilyen hiteles információt kap a HUN-REN részéről, azt széles körben ismertetik, de azzal is megelégednek, ha ezeket a tényeket a Gulyás Balázsék által indított eljárások keretében a bíróság tárja fel és hozza nyilvánosságra.",https://hvg.hu/itthon/20251223_Az-Akademia-Dolgozok-Foruma-nem-fel-a-HUN-REN-fenyegetozesetol
A halálösztön a sajátunk – Kövesdi Veronika médiakutató az új Lánthimosz-film zseniális végkövetkeztetéséről,2025-12-23 17:30:00+00:00,hvg360,"Rendkívüli ünnepi ajánlóink többi darabjátittolvashatja.Bevallom töredelmesen, kissé szemforgatva ültem volna be még egy antikapitalista történetre, hogy a nép kilátástalan küzdelmét szemléljem a kizsákmányoló elittel szemben. Még akkor is, ha a szívemnek oly kedves összeesküvéselmélet-híveké a főszerep.Persze aki kifejezetten az említett narratív sémára vágyik, megtalálja a filmben: Michelle Fullert, egy gyógyszergyár vezetőjét elrabolja két ufóhívő, mert szerintük földönkívüli, aki kiirtja a méhkolóniákat, és rabszolgává teszi az emberiséget.Ugyanakkor Jórgosz Lánthimosz rendező – Ari Aster producerrel – azért kecsegtetett számomra is reményekkel.",https://hvg.hu/360/20251223_hvg-ajanlo-Kovesdi-Veronika-Bugonia-film
Lisztériagyanú miatt hívják vissza a Lidl juhtúróját,2025-12-23 17:27:00+00:00,Gazdaság,"A Nemzeti Kereskedelmi és Fogyasztóvédelmi Hatóság visszavonja a Lidlben kapható Pilos Bryndza nevű, 125 g megnevezésű zöld csomagolású, juh- és tehéntejből készült juhtúrót – derült ki keddiközleményükből. A visszahívás oka, hogy a termékben nem kizárható a Listeria monocytogenes jelenléte.Ez a baktérium okozza a liszteriózis nevű betegséget, ami egészséges emberekben sokszor semmilyen tünetet nem vált ki, a jó ellenállóképességű felnőttek a fertőzést a legtöbbször tünetmentesen átvészelik, viszont a csecsemőknél, a várandós nőknél, és az időseknél nagyobb veszélye van a súlyos lefolyású megbetegedés kialakulásának, esetükben akár szepszis, agyhártyagyulladás is kialakulhat – írja aWebbeteg.A baktérium hűtőhőmérsékleten is képes elszaporodni és túléli a fagyasztást is. Ha valaki megfertőződik, akkor már a fogyasztást követő első napon jelentkezhetnek ételmérgezéses tünetek: hasmenés, hányás, fejfájás, hőemelkedés vagy láz.A hatóság kéri azokat, akik vásároltak a tejtermékből, hogy ne fogyasszák el azt. Az adatai a következők:termék megnevezése: Pilos Bryndza juh- és tehéntejből 125 g,minőségmegőrzési idő: 2026. január 2.,tételazonosító: L171225,gyártó: Agrofarma, spol. S.r.o.Nemzeti Kereskedelmi és Fogyasztóvédelmi HatóságNyitókép: Nemzeti Kereskedelmi és Fogyasztóvédelmi Hatóság",https://hvg.hu/gazdasag/20251223_Liszteriaszennyezes-termekvisszahivas-lidl-pilos-turo-tejtermek-juh-tehen-fogyasztovedelmi-hatosag
"A Kösz, jól különkiadása: együtt főzött Tomán Szabina, Tatár Csilla és Farkas Richárd, a Penny séfje",2025-12-23 17:10:00+00:00,Élet+Stílus,"Mitől lesz hiteles egy életmódprogram? Hogyan tudunk eligazodni az életmódpiacon? Mennyire tájékozott a magyar fogyasztó? A longevity programokkal csak a nőket célozzák? Hogyan küzdik le a félelmeiket a női vállalkozók? Ezekre a kérdésekre kereste a választ vendégeivel Bánhalmi Kata, a Kösz, jól karácsonyi különkiadásában. A tavalyi évhez hasonlóan nemcsak beszélgettek Tomán Szabinával és Tatár Csillával, hanem besegítettek Farkas Richárdnak, a Penny séfjének, és együtt készítettek el egy finom és könnyű karácsonyi menüt is.No TitleNo DescriptionA műsort és a pénztárcabarát egészségtudatos élelmiszereket a PENNY támogatja.Kövesd és hallgasd meg a HVG Podcastok műsorait az alábbi platformok bármelyikén:Spotify,Apple Podcasts,SoundCloud,Youtube.Vagy iratkozz fel a Kösz, jól csatornájára itt:Spotify,Apple Podcasts",https://hvg.hu/elet/20251223_Kosz-jol-kulonkiadas-longevity-egeszseges-karacsonyi-menu-sefek-podcast
"Karácsonyfa jégből? A kutatók már kinyomtatták, és ennek nagyon is van értelme – videó",2025-12-23 17:03:00+00:00,Tech,"Az Amszterdami Egyetem fizikusai elkészítették az egyik legjobb karácsonyi dekort: egy mini, 3D-nyomtatott karácsonyfát. A dolog igazi különlegessége azonban az, hogy nem kellett hozzá semmilyen hűtőberendezés, ráadásul még olcsó is. Mondjuk ettől még nem tudja megcsinálni otthon.A dolog kulcsa a párologtató hűtés, mely már a természetben is jól ismert: az emlősök például így szabályozzák a testhőmérsékletüket, de abban is szerepe van, hogy a reggeli kávéja gőzölög.Mint azArsTechnikakiemeli, a jégnyomtatás módszerei rendszerint a kriogenikán vagy valamilyen hűtött hordozón alapszanak. AzarXivpreprint szerveren megjelent kutatás szerzői szerint ők az elsők, akik a párologtató hűtés módszerét alkalmazták 3D-nyomtatshoz.A dolog nehézsége az volt, hogy a folyamat egy vákuumkamrában ment végbe, a nyomtatófej pedig egy sugárfúvóka volt. „A nyomtató mozgásvezérlése rétegenként irányította a vízsugarat, igény szerint felépítve a geometriát” – magyarázzák a szerzők, megjegyezve, hogy rendkívül alacsony víznyomás mellett a folyadék felületén lévő vízmolekulák folyamatosan távoznak. Méghozzá gőzként.Printed Christmas Tree – Made of IceAn Ice Christmas tree: fast three-dimensional printed Christmas tree via evaporative cooling in vacuum. Total construction time was 26 minutes at 2 mbar. The physics underlying our method is straightforward yet elegant. The 3D printer is enclosed inside a vacuum chamber, where the freezing process is driven by the rapid evaporation of the deposited water, causing it to solidify onto the previously printed layer.A távozó molekulák magukkal viszik a párolgás hőjét, így hűtik a vízsugarat. A nyomtatáshoz használtsugár felület-térfogat-aránya nagyon nagy, mely rendkívül hatékonnyá teszi a hőelvonást. A folyadék így gyorsan lehűl. Ha a vízsugár eléri az anyagot, vagy egy egy korábban lerakódott jégréteget, már az ütközés pillanatában megfagy.A kutatók ezúttal egy karácsonyfát készítettek el így, de természetesen nem csak erre jó a módszer. Például biológiai alkalmazásban is hasznos lehet, mondjuk vázszerkezetekhez. Egy ilyen jégforma gyantába vagy polimerbe önthető, és ha elolvadt, üreges csatornákat hagy csak maga után. Sőt, akár mikrofluidikai folyafékhálózatok létrehozásához is használható. Arról nem is beszélve, hogy akár a Marson is lehet így nyomtatni vízjégből.Ha máskor is tudni szeretne hasonló dolgokról, lájkoljaa HVG Tech rovatának tudományos felfedezésekről is hírt adó Facebook-oldalát.",https://hvg.hu/tudomany/20251223_3d-nyomtatott-karacsonyfa-vakuum-viz-kutatas
"Jake Paul borzalmasan sok pénzzel és fegyverekkel pózolt egy magángépen, miután kiütötték",2025-12-23 16:57:23+00:00,Sport,"Jake Paul egy olyan fotót osztott meg a legutóbbi bokszmeccse után, amin rengeteg pénzzel és több fegyverrel látható egy magángépen – írja aNew York Post.A bejegyzés megtekintése az InstagramonJake Paul (@jakepaul) által megosztott bejegyzésA youtuberből lett bokszolót a brit egykori nehézsúlyú világbajnok Anthony Joshua ütötte ki szombaton, ráadásul Jake Paul súlyosan megsérült a mérkőzésen, két helyen is eltört az állkapcsa. Azóta meg is műtötték, a kétoldali törést lemezekkel, csavarokkal rögzítették, az egyik területen a fogakat és azok gyökereit is el kellett távolítani.Kiütötte és az állkapcsát is eltörte Anthony Joshua az influenszerből lett ellenfelénekAz olimpiai és kétszeres profi világbajnok már négyszer is padlóra küldte Jake Pault, mire a bíró beszüntette a küzdelmet.A lap szerint azonban a pénz gyógyír lehet a szenvedésre. Bár a pontos összegek nem ismertek, megjelent olyan adat is, hogy Paul 92 millió dollárt keresett Joshua elleni meccsen, bár novemberben Paul azt állította, hogy ez akár 267 millió dollár is lehet.A fotón hat fegyvert is villantott a youtuber, közte van két az iskolai lövöldözésekről elhíresült AR-15, egy mesterlövész puska és pisztolyok is.Bár Jake Paul azt mondta, hogy készül a visszatérésre a ringbe, deez közel sem biztos, hogy menni fog. Az állkapocs-sérülése miatt ugyanis nem biztos, hogy engedélyt fog erre kapni.(Fotó: AFP/Giorgio Viera)",https://hvg.hu/sport/20251223_jake-paul-penz-fegyverek-magangep
"Szoboszlai Dominik felesége megosztotta, milyen karácsonyfával készülnek az ünnepekre",2025-12-23 16:54:16+00:00,Élet+Stílus,"Hatalmas, elegánsan díszített karácsonyfával készül az ünnepre Szoboszlai Dominik felesége, Buzsik Borka és kislányuk. Erről egy képet a focista felesége osztott meg az Instagram-oldalán.Mivel a történetében osztotta meg, ezért az már nem látható, ám afeol.huoldalán még elérhető a kép. A lap megjegyezte, hogy a fán látható négy darabból álló Christian Dior karácsonyfadísz-kollekció ára 450 euró, azaz nagyjából 175 ezer forint.A pár tavasszal tartotta azesküvőt, és augusztusbanszületett mega kislányuk, ez lesz az első közös karácsonyuk hármasban. A sportolónak nem csak a magánéletében volt sűrű a2025-ös év, ugyanis idén volt először, hogy magyar futballista Premier League-győztessé vált, hiszen Szoboszlai Dominik is a magasba emelhette április végén az angol bajnokság trófeáját. A magyar válogatott csapatkapitánya az előző szezonban is kulcsember volt a Liverpool csapatában, idén pedig a bajnokság minden meccsén bekerült a kezdő 11-be, ahol szakértők szerint az egyik legkiegyensúlyozottabb teljesítményt nyújtja.Szoboszlai Dominik nyáron a HVG-nek is nyilatkozott, vele készült interjúnkatittolvashatják.Nyitókép: Cabrera Martin",https://hvg.hu/elet/20251223_Szoboszlai-Dominik-felesege-Dior-luxusdiszeket-aggathatott-karacsonyfa-focista-liverpool-buzsik-borka-magyar-valogatott
